fs.s3a.aws.credentials.provider," Comma-separated class names of credential provider classes which implement com.amazonaws.auth.AWSCredentialsProvider. These are loaded and queried in sequence for a valid set of credentials. Each listed class must implement one of the following means of construction, which are attempted in order: 1. a public constructor accepting java.net.URI and  org.apache.hadoop.conf.Configuration, 2. a public static method named getInstance that accepts no    arguments and returns an instance of    com.amazonaws.auth.AWSCredentialsProvider, or 3. a public default constructor. Specifying org.apache.hadoop.fs.s3a.AnonymousAWSCredentialsProvider allows anonymous access to a publicly accessible S3 bucket without any credentials. Please note that allowing anonymous access to an S3 bucket compromises security and therefore is unsuitable for most use cases. It can be useful for accessing public data sets without requiring AWS credentials. If unspecified, then the default list of credential provider classes, queried in sequence, is: 1. org.apache.hadoop.fs.s3a.BasicAWSCredentialsProvider: supports static  configuration of AWS access key ID and secret access key.  See also  fs.s3a.access.key and fs.s3a.secret.key. 2. com.amazonaws.auth.EnvironmentVariableCredentialsProvider: supports  configuration of AWS access key ID and secret access key in  environment variables named AWS_ACCESS_KEY_ID and  AWS_SECRET_ACCESS_KEY, as documented in the AWS SDK. 3. org.apache.hadoop.fs.s3a.SharedInstanceProfileCredentialsProvider:  a shared instance of  com.amazonaws.auth.InstanceProfileCredentialsProvider from the AWS  SDK, which supports use of instance profile credentials if running  in an EC2 VM.  Using this shared instance potentially reduces load  on the EC2 instance metadata service for multi-threaded  applications.  ",
fs.s3a.session.token,"Session token, when using org.apache.hadoop.fs.s3a.TemporaryAWSCredentialsProvider as one of the providers.  ",
fs.s3a.security.credential.provider.path," Optional comma separated list of credential providers, a list which is prepended to that set in hadoop.security.credential.provider.path  ",
fs.s3a.connection.maximum,Controls the maximum number of simultaneous connections to S3.,15
fs.s3a.connection.ssl.enabled,Enables or disables SSL connections to S3.,true
fs.s3a.endpoint,"AWS S3 endpoint to connect to. An up-to-date list is provided in the AWS Documentation: regions and endpoints. Without this property, the standard region (s3.amazonaws.com) is assumed.  ",
fs.s3a.path.style.access,Enable S3 path style access ie disabling the default virtual hosting behaviour. Useful for S3A-compliant storage providers as it removes the need to set up DNS for virtual hosting.  ,false
fs.s3a.proxy.host,Hostname of the (optional) proxy server for S3 connections.,
fs.s3a.proxy.port,"Proxy server port. If this property is not set but fs.s3a.proxy.host is, port 80 or 443 is assumed (consistent with the value of fs.s3a.connection.ssl.enabled).",
fs.s3a.proxy.username,Username for authenticating with proxy server.,
fs.s3a.proxy.password,Password for authenticating with proxy server.,
fs.s3a.proxy.domain,Domain for authenticating with proxy server.,
fs.s3a.proxy.workstation,Workstation for authenticating with proxy server.,
fs.s3a.attempts.maximum,How many times we should retry commands on transient errors.,20
fs.s3a.connection.establish.timeout,Socket connection setup timeout in milliseconds.,5000
fs.s3a.connection.timeout,Socket connection timeout in milliseconds.,200000
fs.s3a.socket.send.buffer,Socket send buffer hint to amazon connector. Represented in bytes.,8192
fs.s3a.socket.recv.buffer,Socket receive buffer hint to amazon connector. Represented in bytes.,8192
fs.s3a.paging.maximum,How many keys to request from S3 when doing  directory listings at a time.,5000
fs.s3a.threads.max,The total number of threads available in the filesystem for data uploads *or any other queued filesystem operation*.,10
fs.s3a.threads.keepalivetime,Number of seconds a thread can be idle before being terminated.,60
fs.s3a.max.total.tasks,The number of operations which can be queued for execution,5
fs.s3a.multipart.size,"How big (in bytes) to split upload or copy operations up into. A suffix from the set {K,M,G,T,P} may be used to scale the numeric value.  ",100M
fs.s3a.multipart.threshold,"How big (in bytes) to split upload or copy operations up into. This also controls the partition size in renamed files, as rename() involves copying the source file(s). A suffix from the set {K,M,G,T,P} may be used to scale the numeric value.  ",2147483647
fs.s3a.multiobjectdelete.enable,"When enabled, multiple single-object delete requests are replaced by a single 'delete multiple objects'-request, reducing the number of requests. Beware: legacy S3-compatible object stores might not support this request.  ",true
fs.s3a.acl.default,"Set a canned ACL for newly created and copied objects. Value may be Private,   PublicRead, PublicReadWrite, AuthenticatedRead, LogDeliveryWrite, BucketOwnerRead,   or BucketOwnerFullControl.",
fs.s3a.multipart.purge,"True if you want to purge existing multipart uploads that may not have been completed/aborted correctly. The corresponding purge age is defined in fs.s3a.multipart.purge.age. If set, when the filesystem is instantiated then all outstanding uploads older than the purge age will be terminated -across the entire bucket. This will impact multipart uploads by other applications and users. so should be used sparingly, with an age value chosen to stop failed uploads, without breaking ongoing operations.  ",false
fs.s3a.multipart.purge.age,Minimum age in seconds of multipart uploads to purge.  ,86400
fs.s3a.server-side-encryption-algorithm,"Specify a server-side encryption algorithm for s3a: file system. Unset by default.  It supports the following values: 'AES256' (for SSE-S3), 'SSE-KMS' and 'SSE-C'.  ",
fs.s3a.server-side-encryption.key,"Specific encryption key to use if fs.s3a.server-side-encryption-algorithm has been set to 'SSE-KMS' or 'SSE-C'. In the case of SSE-C, the value of this property should be the Base64 encoded key. If you are using SSE-KMS and leave this property empty, you'll be using your default's S3 KMS key, otherwise you should set this property to the specific KMS key id.  ",
fs.s3a.signing-algorithm,Override the default signing algorithm so legacy implementations can still be used,
fs.s3a.block.size,"Block size to use when reading files using s3a: file system. A suffix from the set {K,M,G,T,P} may be used to scale the numeric value.  ",32M
fs.s3a.buffer.dir,Comma separated list of directories that will be used to buffer file uploads to.,${hadoop.tmp.dir}/s3a
fs.s3a.fast.upload, Use the incremental block-based fast upload mechanism with the buffering mechanism set in fs.s3a.fast.upload.buffer.  ,false
fs.s3a.fast.upload.buffer," The buffering mechanism to use when using S3A fast upload (fs.s3a.fast.upload=true). Values: disk, array, bytebuffer. This configuration option has no effect if fs.s3a.fast.upload is false. ""disk"" will use the directories listed in fs.s3a.buffer.dir as the location(s) to save data prior to being uploaded. ""array"" uses arrays in the JVM heap ""bytebuffer"" uses off-heap memory within the JVM. Both ""array"" and ""bytebuffer"" will consume memory in a single stream up to the number of blocks set by:  fs.s3a.multipart.size * fs.s3a.fast.upload.active.blocks. If using either of these mechanisms, keep this value low The total number of threads performing work across all threads is set by fs.s3a.threads.max, with fs.s3a.max.total.tasks values setting the number of queued work items.  ",disk
fs.s3a.fast.upload.active.blocks," Maximum Number of blocks a single output stream can have active (uploading, or queued to the central FileSystem instance's pool of queued operations. This stops a single stream overloading the shared thread pool.  ",4
fs.s3a.readahead.range,"Bytes to read ahead during a seek() before closing and  re-opening the S3 HTTP connection. This option will be overridden if  any call to setReadahead() is made to an open stream.  A suffix from the set {K,M,G,T,P} may be used to scale the numeric value.  ",64K
fs.s3a.user.agent.prefix," Sets a custom value that will be prepended to the User-Agent header sent in HTTP requests to the S3 back-end by S3AFileSystem.  The User-Agent header always includes the Hadoop version number followed by a string generated by the AWS SDK.  An example is ""User-Agent: Hadoop 2.8.0, aws-sdk-java/1.10.6"". If this optional property is set, then its value is prepended to create a customized User-Agent.  For example, if this configuration property was set to ""MyApp"", then an example of the resulting User-Agent would be ""User-Agent: MyApp, Hadoop 2.8.0, aws-sdk-java/1.10.6"".  ",
fs.s3a.metadatastore.authoritative,"  When true, allow MetadataStore implementations to act as source of  truth for getting file status and directory listings.  Even if this  is set to true, MetadataStore implementations may choose not to  return authoritative results.  If the configured MetadataStore does  not support being authoritative, this setting will have no effect. ",false
fs.s3a.metadatastore.impl,"  Fully-qualified name of the class that implements the MetadataStore  to be used by s3a.  The default class, NullMetadataStore, has no  effect: s3a will continue to treat the backing S3 service as the one  and only source of truth for file and directory metadata. ",org.apache.hadoop.fs.s3a.s3guard.NullMetadataStore
fs.s3a.s3guard.cli.prune.age,  Default age (in milliseconds) after which to prune metadata from the  metadatastore when the prune command is run.  Can be overridden on the  command-line. ,86400000
fs.s3a.impl,The implementation class of the S3A Filesystem,org.apache.hadoop.fs.s3a.S3AFileSystem
fs.s3a.s3guard.ddb.region," AWS DynamoDB region to connect to. An up-to-date list is provided in the AWS Documentation: regions and endpoints. Without this property, the S3Guard will operate table in the associated S3 bucket region.  ",
fs.s3a.s3guard.ddb.table," The DynamoDB table name to operate. Without this property, the respective S3 bucket name will be used.  ",
fs.s3a.s3guard.ddb.table.create," If true, the S3A client will create the table if it does not already exist.  ",false
fs.s3a.s3guard.ddb.table.capacity.read," Provisioned throughput requirements for read operations in terms of capacity units for the DynamoDB table.  This config value will only be used when creating a new DynamoDB table, though later you can manually provision by increasing or decreasing read capacity as needed for existing tables. See DynamoDB documents for more information.  ",500
fs.s3a.s3guard.ddb.table.capacity.write, Provisioned throughput requirements for write operations in terms of capacity units for the DynamoDB table.  Refer to related config fs.s3a.s3guard.ddb.table.capacity.read before usage.  ,100
fs.s3a.s3guard.ddb.max.retries,"   Max retries on batched DynamoDB operations before giving up and   throwing an IOException.  Each retry is delayed with an exponential   backoff timer which starts at 100 milliseconds and approximately   doubles each time.  The minimum wait before throwing an exception is   sum(100, 200, 400, 800, .. 100*2^N-1 ) == 100 * ((2^N)-1)   So N = 9 yields at least 51.1 seconds (51,100) milliseconds of blocking   before throwing an IOException. ",9
fs.s3a.s3guard.ddb.background.sleep, Length (in milliseconds) of pause between each batch of deletes when pruning metadata.  Prevents prune operations (which can typically be low priority background operations) from overly interfering with other I/O operations.  ,25
fs.AbstractFileSystem.s3a.impl,The implementation class of the S3A AbstractFileSystem.,org.apache.hadoop.fs.s3a.S3A
fs.wasb.impl,The implementation class of the Native Azure Filesystem,org.apache.hadoop.fs.azure.NativeAzureFileSystem
fs.wasbs.impl,The implementation class of the Secure Native Azure Filesystem,org.apache.hadoop.fs.azure.NativeAzureFileSystem$Secure
fs.azure.secure.mode," Config flag to identify the mode in which fs.azure.NativeAzureFileSystem needs to run under. Setting it ""true"" would make fs.azure.NativeAzureFileSystem use SAS keys to communicate with Azure storage.  ",false
fs.azure.local.sas.key.mode," Works in conjuction with fs.azure.secure.mode. Setting this config to true results in fs.azure.NativeAzureFileSystem using the local SAS key generation where the SAS keys are generating in the same process as fs.azure.NativeAzureFileSystem. If fs.azure.secure.mode flag is set to false, this flag has no effect.  ",false
fs.azure.sas.expiry.period," The default value to be used for expiration period for SAS keys generated. Can use the following suffix (case insensitive): ms(millis), s(sec), m(min), h(hour), d(day) to specify the time (such as 2s, 2m, 1h, etc.).  ",90d
fs.azure.authorization," Config flag to enable authorization support in WASB. Setting it to ""true"" enables authorization support to WASB. Currently WASB authorization requires a remote service to provide authorization that needs to be specified via fs.azure.authorization.remote.service.url configuration  ",false
fs.azure.authorization.caching.enable, Config flag to enable caching of authorization results and saskeys in WASB. This flag is relevant only when fs.azure.authorization is enabled.  ,true
fs.azure.saskey.usecontainersaskeyforallaccess, Use container saskey for access to all blobs within the container. Blob-specific saskeys are not used when this setting is enabled. This setting provides better performance compared to blob-specific saskeys.  ,true
fs.adl.impl,,org.apache.hadoop.fs.adl.AdlFileSystem
fs.AbstractFileSystem.adl.impl,,org.apache.hadoop.fs.adl.Adl
io.seqfile.compress.blocksize,The minimum block size for compression in block compressed    SequenceFiles.  ,1000000
io.mapfile.bloom.size,"The size of BloomFilter-s used in BloomMapFile. Each time this many  keys is appended the next BloomFilter will be created (inside a DynamicBloomFilter).  Larger values minimize the number of filters, which slightly increases the performance,  but may waste too much space if the total number of keys is usually much smaller  than this number.  ",1048576
io.mapfile.bloom.error.rate,"The rate of false positives in BloomFilter-s used in BloomMapFile.  As this value decreases, the size of BloomFilter-s increases exponentially. This  value is the probability of encountering false positives (default is 0.5%).  ",0.005
hadoop.util.hash.type,The default implementation of Hash. Currently this can take one of the  two values: 'murmur' to select MurmurHash and 'jenkins' to select JenkinsHash.  ,murmur
ipc.client.idlethreshold,Defines the threshold number of connections after which      connections will be inspected for idleness.  ,4000
ipc.client.kill.max,Defines the maximum number of clients to disconnect in one go.  ,10
ipc.client.connection.maxidletime,The maximum time in msec after which a client will bring down the      connection to the server.  ,10000
ipc.client.connect.max.retries,Indicates the number of retries a client will make to establish      a server connection.  ,10
ipc.client.connect.retry.interval,Indicates the number of milliseconds a client will wait for before retrying to establish a server connection.  ,1000
ipc.client.connect.timeout,Indicates the number of milliseconds a client will wait for the      socket to establish a server connection.  ,20000
ipc.client.connect.max.retries.on.timeouts,Indicates the number of retries a client will make on socket timeout      to establish a server connection.  ,45
ipc.client.tcpnodelay,Use TCP_NODELAY flag to bypass Nagle's algorithm transmission delays.  ,true
ipc.client.low-latency,Use low-latency QoS markers for IPC connections.  ,false
ipc.client.ping,"Send a ping to the server when timeout on reading the response,  if set to true. If no failure is detected, the client retries until at least  a byte is read or the time given by ipc.client.rpc-timeout.ms is passed.  ",true
ipc.ping.interval,"Timeout on waiting response from server, in milliseconds.  The client will send ping when the interval is passed without receiving bytes,  if ipc.client.ping is set to true.  ",60000
ipc.client.rpc-timeout.ms,"Timeout on waiting response from server, in milliseconds.  If ipc.client.ping is set to true and this rpc-timeout is greater than  the value of ipc.ping.interval, the effective value of the rpc-timeout is  rounded up to multiple of ipc.ping.interval.  ",0
ipc.server.listen.queue.size,Indicates the length of the listen queue for servers accepting      client connections.  ,128
ipc.server.log.slow.rpc,This setting is useful to troubleshoot performance issues for  various services. If this value is set to true then we log requests that  fall into 99th percentile as well as increment RpcSlowCalls counter. ,false
ipc.maximum.data.length,This indicates the maximum IPC message length (bytes) that can be accepted by the server. Messages larger than this value are rejected by the immediately to avoid possible OOMs. This setting should rarely need to be changed.  ,67108864
ipc.maximum.response.length,This indicates the maximum IPC message length (bytes) that can be accepted by the client. Messages larger than this value are rejected immediately to avoid possible OOMs. This setting should rarely need to be changed.  Set to 0 to disable.  ,134217728
hadoop.security.impersonation.provider.class,"A class which implements ImpersonationProvider interface, used to    authorize whether one user can impersonate a specific user.    If not specified, the DefaultImpersonationProvider will be used.    If a class is specified, then that class will be used to determine    the impersonation capability.  ",
hadoop.rpc.socket.factory.class.default," Default SocketFactory to use. This parameter is expected to be formatted as ""package.FactoryClassName"".  ",org.apache.hadoop.net.StandardSocketFactory
hadoop.rpc.socket.factory.class.ClientProtocol," SocketFactory to use to connect to a DFS. If null or empty, use hadoop.rpc.socket.class.default. This socket factory is also used by DFSClient to create sockets to DataNodes.  ",
hadoop.socks.server, Address (host:port) of the SOCKS server to be used by the SocksSocketFactory.  ,
net.topology.node.switch.mapping.impl," The default implementation of the DNSToSwitchMapping. It invokes a script specified in net.topology.script.file.name to resolve node names. If the value for net.topology.script.file.name is not set, the default value of DEFAULT_RACK is returned for all node names.  ",org.apache.hadoop.net.ScriptBasedMapping
net.topology.impl, The default implementation of NetworkTopology which is classic three layer one.  ,org.apache.hadoop.net.NetworkTopology
net.topology.script.file.name," The script name that should be invoked to resolve DNS names to NetworkTopology names. Example: the script would take host.foo.bar as an argument, and return /rack1 as the output.  ",
net.topology.script.number.args, The max number of args that the script configured with net.topology.script.file.name should be run with. Each arg is an IP address.  ,100
net.topology.table.file.name," The file name for a topology file, which is used when the net.topology.node.switch.mapping.impl property is set to org.apache.hadoop.net.TableMapping. The file format is a two column text file, with columns separated by whitespace. The first column is a DNS or IP address and the second column specifies the rack where the address maps. If no entry corresponding to a host in the cluster is found, then /default-rack is assumed.  ",
file.stream-buffer-size,"The size of buffer to stream files.  The size of this buffer should probably be a multiple of hardware  page size (4096 on Intel x86), and it determines how much data is  buffered during read and write operations.",4096
file.bytes-per-checksum,The number of bytes per checksum.  Must not be larger than  file.stream-buffer-size,512
file.client-write-packet-size,Packet size for clients to write,65536
file.blocksize,Block size,67108864
file.replication,Replication factor,1
s3.stream-buffer-size,"The size of buffer to stream files.  The size of this buffer should probably be a multiple of hardware  page size (4096 on Intel x86), and it determines how much data is  buffered during read and write operations.",4096
s3.bytes-per-checksum,The number of bytes per checksum.  Must not be larger than  s3.stream-buffer-size,512
s3.client-write-packet-size,Packet size for clients to write,65536
s3.blocksize,Block size,67108864
s3.replication,Replication factor,3
s3native.stream-buffer-size,"The size of buffer to stream files.  The size of this buffer should probably be a multiple of hardware  page size (4096 on Intel x86), and it determines how much data is  buffered during read and write operations.",4096
s3native.bytes-per-checksum,The number of bytes per checksum.  Must not be larger than  s3native.stream-buffer-size,512
s3native.client-write-packet-size,Packet size for clients to write,65536
s3native.blocksize,Block size,67108864
s3native.replication,Replication factor,3
ftp.stream-buffer-size,"The size of buffer to stream files.  The size of this buffer should probably be a multiple of hardware  page size (4096 on Intel x86), and it determines how much data is  buffered during read and write operations.",4096
ftp.bytes-per-checksum,The number of bytes per checksum.  Must not be larger than  ftp.stream-buffer-size,512
ftp.client-write-packet-size,Packet size for clients to write,65536
ftp.blocksize,Block size,67108864
ftp.replication,Replication factor,3
tfile.io.chunk.size, Value chunk size in bytes. Default  to 1MB. Values of the length less than the chunk size is guaranteed to have known value length in read time (See also TFile.Reader.Scanner.Entry.isValueLengthKnown()).  ,1048576
tfile.fs.output.buffer.size, Buffer size used for FSDataOutputStream in bytes.  ,262144
tfile.fs.input.buffer.size, Buffer size used for FSDataInputStream in bytes.  ,262144
hadoop.http.authentication.type, Defines authentication used for Oozie HTTP endpoint. Supported values are: simple | kerberos | #AUTHENTICATION_HANDLER_CLASSNAME#  ,simple
hadoop.http.authentication.token.validity, Indicates how long (in seconds) an authentication token is valid before it has to be renewed.  ,36000
hadoop.http.authentication.signature.secret.file, The signature secret for signing the authentication tokens. The same secret should be used for JT/NN/DN/TT configurations.  ,${user.home}/hadoop-http-auth-signature-secret
hadoop.http.authentication.cookie.domain," The domain to use for the HTTP cookie that stores the authentication token. In order to authentiation to work correctly across all Hadoop nodes web-consoles the domain must be correctly set. IMPORTANT: when using IP addresses, browsers ignore cookies with domain settings. For this setting to work properly all nodes in the cluster must be configured to generate URLs with hostname.domain names on it.  ",
hadoop.http.authentication.simple.anonymous.allowed, Indicates if anonymous requests are allowed when using 'simple' authentication.  ,true
hadoop.http.authentication.kerberos.principal, Indicates the Kerberos principal to be used for HTTP endpoint. The principal MUST start with 'HTTP/' as per Kerberos HTTP SPNEGO specification.  ,HTTP/_HOST@LOCALHOST
hadoop.http.authentication.kerberos.keytab, Location of the keytab file with the credentials for the principal. Referring to the same keytab file Oozie uses for its Kerberos credentials for Hadoop.  ,${user.home}/hadoop.keytab
hadoop.http.cross-origin.enabled,Enable/disable the cross-origin (CORS) filter.,false
hadoop.http.cross-origin.allowed-origins,Comma separated list of origins that are allowed for web services needing cross-origin (CORS) support. Wildcards (*) and patterns allowed,*
hadoop.http.cross-origin.allowed-methods,Comma separated list of methods that are allowed for web services needing cross-origin (CORS) support.,"GET,POST,HEAD"
hadoop.http.cross-origin.allowed-headers,Comma separated list of headers that are allowed for web services needing cross-origin (CORS) support.,"X-Requested-With,Content-Type,Accept,Origin"
hadoop.http.cross-origin.max-age,The number of seconds a pre-flighted request can be cached for web services needing cross-origin (CORS) support.,1800
dfs.ha.fencing.methods, List of fencing methods to use for service fencing. May contain builtin methods (eg shell and sshfence) or user-defined method.  ,
dfs.ha.fencing.ssh.connect-timeout," SSH connection timeout, in milliseconds, to use with the builtin sshfence fencer.  ",30000
dfs.ha.fencing.ssh.private-key-files, The SSH private key files to use with the builtin sshfence fencer.  ,
hadoop.http.staticuser.user," The user name to filter as, on static web filters while rendering content. An example use is the HDFS web UI (user to be used for browsing files).  ",dr.who
ha.zookeeper.quorum," A list of ZooKeeper server addresses, separated by commas, that are to be used by the ZKFailoverController in automatic failover.  ",
ha.zookeeper.session-timeout.ms," The session timeout to use when the ZKFC connects to ZooKeeper. Setting this value to a lower value implies that server crashes will be detected more quickly, but risks triggering failover too aggressively in the case of a transient error or network blip.  ",10000
ha.zookeeper.parent-znode," The ZooKeeper znode under which the ZK failover controller stores its information. Note that the nameservice ID is automatically appended to this znode, so it is not normally necessary to configure this, even in a federated environment.  ",/hadoop-ha
