ha.zookeeper.acl," A comma-separated list of ZooKeeper ACLs to apply to the znodes used by automatic failover. These ACLs are specified in the same format as used by the ZooKeeper CLI. If the ACL itself contains secrets, you may instead specify a path to a file, prefixed with the '@' symbol, and the value of this configuration will be loaded from within.  ",world:anyone:rwcda
ha.zookeeper.auth," A comma-separated list of ZooKeeper authentications to add when connecting to ZooKeeper. These are specified in the same format as used by the ""addauth"" command in the ZK CLI. It is important that the authentications specified here are sufficient to access znodes with the ACL specified in ha.zookeeper.acl. If the auths contain secrets, you may instead specify a path to a file, prefixed with the '@' symbol, and the value of this configuration will be loaded from within.  ",
hadoop.ssl.keystores.factory.class, The keystores factory to use for retrieving certificates.  ,org.apache.hadoop.security.ssl.FileBasedKeyStoresFactory
hadoop.ssl.require.client.cert,Whether client certificates are required,false
hadoop.ssl.hostname.verifier," The hostname verifier to provide for HttpsURLConnections. Valid values are: DEFAULT, STRICT, STRICT_IE6, DEFAULT_AND_LOCALHOST and ALLOW_ALL  ",DEFAULT
hadoop.ssl.server.conf," Resource file from which ssl server keystore information will be extracted. This file is looked up in the classpath, typically it should be in Hadoop conf/ directory.  ",ssl-server.xml
hadoop.ssl.client.conf," Resource file from which ssl client keystore information will be extracted This file is looked up in the classpath, typically it should be in Hadoop conf/ directory.  ",ssl-client.xml
hadoop.ssl.enabled, Deprecated. Use dfs.http.policy and yarn.http.policy instead.  ,false
hadoop.ssl.enabled.protocols, The supported SSL protocols.  ,"TLSv1,SSLv2Hello,TLSv1.1,TLSv1.2"
hadoop.jetty.logs.serve.aliases, Enable/Disable aliases serving from jetty  ,true
fs.permissions.umask-mode," The umask used when creating files and directories. Can be in octal or in symbolic. Examples are: ""022"" (octal for u=rwx,g=r-x,o=r-x in symbolic), or ""u=rwx,g=rwx,o="" (symbolic for 007 in octal).  ",022
ha.health-monitor.connect-retry-interval.ms, How often to retry connecting to the service.  ,1000
ha.health-monitor.check-interval.ms, How often to check the service.  ,1000
ha.health-monitor.sleep-after-disconnect.ms, How long to sleep after an unexpected RPC error.  ,1000
ha.health-monitor.rpc-timeout.ms, Timeout for the actual monitorHealth() calls.  ,45000
ha.failover-controller.new-active.rpc-timeout.ms, Timeout that the FC waits for the new active to become active  ,60000
ha.failover-controller.graceful-fence.rpc-timeout.ms, Timeout that the FC waits for the old active to go to standby  ,5000
ha.failover-controller.graceful-fence.connection.retries, FC connection retries for graceful fencing  ,1
ha.failover-controller.cli-check.rpc-timeout.ms," Timeout that the CLI (manual) FC waits for monitorHealth, getServiceState  ",20000
ipc.client.fallback-to-simple-auth-allowed," When a client is configured to attempt a secure connection, but attempts to connect to an insecure server, that server may instruct the client to switch to SASL SIMPLE (unsecure) authentication. This setting controls whether or not the client will accept this instruction from the server. When false (the default), the client will not allow the fallback to SIMPLE authentication, and will abort the connection.  ",false
fs.client.resolve.remote.symlinks,"   Whether to resolve symlinks when accessing a remote Hadoop filesystem.   Setting this to false causes an exception to be thrown upon encountering   a symlink. This setting does not apply to local filesystems, which   automatically resolve local symlinks.  ",true
nfs.exports.allowed.hosts," By default, the export can be mounted by any client. The value string contains machine name and access privilege, separated by whitespace characters. The machine name format can be a single host, a Java regular expression, or an IPv4 address. The access privilege uses rw or ro to specify read/write or read-only access of the machines to exports. If the access privilege is not provided, the default is read-only. Entries are separated by "";"". For example: ""192.168.0.0/22 rw ; host.*\.example\.com ; host1.test.org ro;"". Only the NFS gateway needs to restart after this property is updated.  ",* rw
hadoop.user.group.static.mapping.overrides," Static mapping of user to groups. This will override the groups if available in the system for the specified user. In other words, groups look-up will not happen for these users, instead groups mapped in this configuration will be used. Mapping should be in this format. user1=group1,group2;user2=;user3=group2; Default, ""dr.who=;"" will consider ""dr.who"" as user without groups.  ",dr.who=;
rpc.metrics.quantile.enable," Setting this property to true and rpc.metrics.percentiles.intervals to a comma-separated list of the granularity in seconds, the 50/75/90/95/99th percentile latency for rpc queue/processing time in milliseconds are added to rpc metrics.  ",false
rpc.metrics.percentiles.intervals, A comma-separated list of the granularity in seconds for the metrics which describe the 50/75/90/95/99th percentile latency for rpc queue/processing time. The metrics are outputted if rpc.metrics.quantile.enable is set to true.  ,
hadoop.security.crypto.codec.classes.EXAMPLECIPHERSUITE," The prefix for a given crypto codec, contains a comma-separated list of implementation classes for a given crypto codec (eg EXAMPLECIPHERSUITE). The first implementation will be used if available, others are fallbacks.  ",
hadoop.security.crypto.codec.classes.aes.ctr.nopadding," Comma-separated list of crypto codec implementations for AES/CTR/NoPadding. The first implementation will be used if available, others are fallbacks.  ","org.apache.hadoop.crypto.OpensslAesCtrCryptoCodec, org.apache.hadoop.crypto.JceAesCtrCryptoCodec"
hadoop.security.crypto.cipher.suite, Cipher suite for crypto codec.  ,AES/CTR/NoPadding
hadoop.security.crypto.jce.provider, The JCE provider name used in CryptoCodec.  ,
hadoop.security.crypto.jceks.key.serialfilter," Enhanced KeyStore Mechanisms in JDK 8u171 introduced jceks.key.serialFilter. If jceks.key.serialFilter is configured, the JCEKS KeyStore uses it during the deserialization of the encrypted Key object stored inside a SecretKeyEntry. If jceks.key.serialFilter is not configured it will cause an error when recovering keystore file in KeyProviderFactory when recovering key from keystore file using JDK 8u171 or newer. The filter pattern uses the same format as jdk.serialFilter. The value of this property will be used as the following: 1. The value of jceks.key.serialFilter system property takes precedence over the value of this property. 2. In the absence of jceks.key.serialFilter system property the value of this property will be set as the value of jceks.key.serialFilter. 3. If the value of this property and jceks.key.serialFilter system property has not been set, org.apache.hadoop.crypto.key.KeyProvider sets a default value for jceks.key.serialFilter.  ",
hadoop.security.crypto.buffer.size, The buffer size used by CryptoInputStream and CryptoOutputStream.  ,8192
hadoop.security.java.secure.random.algorithm, The java secure random algorithm.  ,SHA1PRNG
hadoop.security.secure.random.impl, Implementation of secure random.  ,
hadoop.security.random.device.file.path, OS security random device file path.  ,/dev/urandom
hadoop.security.key.provider.path," The KeyProvider to use when managing zone keys, and interacting with encryption keys when reading and writing to an encryption zone. For hdfs clients, the provider path will be same as namenode's provider path.  ",
fs.har.impl.disable.cache,Don't cache 'har' filesystem instances.,true
hadoop.security.kms.client.authentication.retry-count, Number of time to retry connecting to KMS on authentication failure  ,1
hadoop.security.kms.client.encrypted.key.cache.size, Size of the EncryptedKeyVersion cache Queue for each key  ,500
hadoop.security.kms.client.encrypted.key.cache.low-watermark," If size of the EncryptedKeyVersion cache Queue falls below the low watermark, this cache queue will be scheduled for a refill  ",0.3f
hadoop.security.kms.client.encrypted.key.cache.num.refill.threads, Number of threads to use for refilling depleted EncryptedKeyVersion cache Queues  ,2
hadoop.security.kms.client.encrypted.key.cache.expiry," Cache expiry time for a Key, after which the cache Queue for this key will be dropped. Default = 12hrs  ",43200000
hadoop.security.kms.client.timeout," Sets value for KMS client connection timeout, and the read timeout to KMS servers.  ",60
hadoop.security.kms.client.failover.sleep.base.millis," Expert only. The time to wait, in milliseconds, between failover attempts increases exponentially as a function of the number of attempts made so far, with a random factor of +/- 50%. This option specifies the base value used in the failover calculation. The first failover will retry immediately. The 2nd failover attempt will delay at least hadoop.security.client.failover.sleep.base.millis milliseconds. And so on.  ",100
hadoop.security.kms.client.failover.sleep.max.millis," Expert only. The time to wait, in milliseconds, between failover attempts increases exponentially as a function of the number of attempts made so far, with a random factor of +/- 50%. This option specifies the maximum value to wait between failovers. Specifically, the time between two failover attempts will not exceed +/- 50% of hadoop.security.client.failover.sleep.max.millis milliseconds.  ",2000
ipc.server.max.connections,"The maximum number of concurrent connections a server is allowed to accept. If this limit is exceeded, incoming connections will first fill the listen queue and then may go to an OS-specific listen overflow queue. The client may fail or timeout, but the server can avoid running out of file descriptors using this feature. 0 means no limit.  ",0
hadoop.registry.rm.enabled,"   Is the registry enabled in the YARN Resource Manager?   If true, the YARN RM will, as needed.   create the user and system paths, and purge   service records when containers, application attempts   and applications complete.   If false, the paths must be created by other means,   and no automatic cleanup of service records will take place. ",false
hadoop.registry.zk.root,   The root zookeeper node for the registry ,/registry
hadoop.registry.zk.session.timeout.ms,   Zookeeper session timeout in milliseconds ,60000
hadoop.registry.zk.connection.timeout.ms,   Zookeeper connection timeout in milliseconds ,15000
hadoop.registry.zk.retry.times,   Zookeeper connection retry count before failing ,5
hadoop.registry.zk.retry.interval.ms, ,1000
hadoop.registry.zk.retry.ceiling.ms,"   Zookeeper retry limit in milliseconds, during   exponential backoff.   This places a limit even   if the retry times and interval limit, combined   with the backoff policy, result in a long retry   period ",60000
hadoop.registry.zk.quorum,   List of hostname:port pairs defining the   zookeeper quorum binding for the registry ,localhost:2181
hadoop.registry.secure,"   Key to set if the registry is secure. Turning it on   changes the permissions policy from ""open access""   to restrictions on kerberos with the option of   a user adding one or more auth key pairs down their   own tree. ",false
hadoop.registry.system.acls,"   A comma separated list of Zookeeper ACL identifiers with   system access to the registry in a secure cluster.   These are given full access to all entries.   If there is an ""@"" at the end of a SASL entry it   instructs the registry client to append the default kerberos domain. ","sasl:yarn@, sasl:mapred@, sasl:hdfs@"
hadoop.registry.kerberos.realm,"   The kerberos realm: used to set the realm of   system principals which do not declare their realm,   and any other accounts that need the value.   If empty, the default realm of the running process   is used.   If neither are known and the realm is needed, then the registry   service/client will fail. ",
hadoop.registry.jaas.context,   Key to define the JAAS context. Used in secure   mode ,Client
hadoop.shell.missing.defaultFs.warning,   Enable hdfs shell commands to display warnings if (fs.defaultFS) property   is not set. ,false
hadoop.shell.safely.delete.limit.num.files,"Used by -safely option of hadoop fs shell -rm command to avoid   accidental deletion of large directories. When enabled, the -rm command   requires confirmation if the number of files to be deleted is greater than   this limit.  The default limit is 100 files. The warning is disabled if   the limit is 0 or the -safely is not specified in -rm command. ",100
fs.client.htrace.sampler.classes,The class names of the HTrace Samplers to use for Hadoop   filesystem clients. ,
hadoop.htrace.span.receiver.classes,The class names of the Span Receivers to use for Hadoop. ,
hadoop.http.logs.enabled,"   Enable the ""/logs"" endpoint on all Hadoop daemons, which serves local   logs, but may be considered a security risk due to it listing the contents   of a directory. ",true
fs.client.resolve.topology.enabled,"Whether the client machine will use the class specified by   property net.topology.node.switch.mapping.impl to compute the network   distance between itself and remote machines of the FileSystem. Additional   properties might need to be configured depending on the class specified   in net.topology.node.switch.mapping.impl. For example, if   org.apache.hadoop.net.ScriptBasedMapping is used, a valid script file   needs to be specified in net.topology.script.file.name. ",false
fs.adl.impl,,org.apache.hadoop.fs.adl.AdlFileSystem
fs.AbstractFileSystem.adl.impl,,org.apache.hadoop.fs.adl.Adl
adl.feature.ownerandgroup.enableupn,"   When true : User and Group in FileStatus/AclStatus response is   represented as user friendly name as per Azure AD profile.   When false (default) : User and Group in FileStatus/AclStatus   response is represented by the unique identifier from Azure AD   profile (Object ID as GUID).   For optimal performance, false is recommended. ",false
fs.adl.oauth2.access.token.provider.type,"   Defines Azure Active Directory OAuth2 access token provider type.   Supported types are ClientCredential, RefreshToken, MSI, DeviceCode,   and Custom.   The ClientCredential type requires property fs.adl.oauth2.client.id,   fs.adl.oauth2.credential, and fs.adl.oauth2.refresh.url.   The RefreshToken type requires property fs.adl.oauth2.client.id and   fs.adl.oauth2.refresh.token.   The MSI type reads optional property fs.adl.oauth2.msi.port, if specified.   The DeviceCode type requires property   fs.adl.oauth2.devicecode.clientapp.id.   The Custom type requires property fs.adl.oauth2.access.token.provider. ",ClientCredential
fs.adl.oauth2.client.id,The OAuth2 client id.,
fs.adl.oauth2.credential,The OAuth2 access key.,
fs.adl.oauth2.refresh.url,The OAuth2 token endpoint.,
fs.adl.oauth2.refresh.token,The OAuth2 refresh token.,
fs.adl.oauth2.access.token.provider,   The class name of the OAuth2 access token provider. ,
fs.adl.oauth2.msi.port,"   The localhost port for the MSI token service. This is the port specified   when creating the Azure VM. The default, if this setting is not specified,   is 50342.   Used by MSI token provider. ",
fs.adl.oauth2.devicecode.clientapp.id,   The app id of the AAD native app in whose context the auth request   should be made.   Used by DeviceCode token provider. ,
hadoop.caller.context.enabled,"When the feature is enabled, additional fields are written into   name-node audit log records for auditing coarse granularity operations. ",false
hadoop.caller.context.max.size,"The maximum bytes a caller context string can have. If the   passed caller context is longer than this maximum bytes, client will   truncate it before sending to server. Note that the server may have a   different maximum size, and will truncate the caller context to the   maximum size it allows. ",128
hadoop.caller.context.signature.max.size,"   The caller's signature (optional) is for offline validation. If the   signature exceeds the maximum allowed bytes in server, the caller context   will be abandoned, in which case the caller context will not be recorded   in audit logs. ",40
seq.io.sort.mb,"   The total amount of buffer memory to use while sorting files,   while using SequenceFile.Sorter, in megabytes. By default,   gives each merge stream 1MB, which should minimize seeks. ",100
seq.io.sort.factor,   The number of streams to merge at once while sorting   files using SequenceFile.Sorter.   This determines the number of open file handles. ,100
hadoop.zk.address,Host:Port of the ZooKeeper server to be used. ,
hadoop.zk.num-retries,Number of tries to connect to ZooKeeper.,1000
hadoop.zk.retry-interval-ms,Retry interval in milliseconds when connecting to ZooKeeper. ,1000
hadoop.zk.timeout-ms,"ZooKeeper session timeout in milliseconds. Session expiration is managed by the ZooKeeper cluster itself, not by the client. This value is used by the cluster to determine when the client's session expires. Expirations happens when the cluster does not hear from the client within the specified session timeout period (i.e. no heartbeat).",10000
hadoop.zk.acl,ACL's to be used for ZooKeeper znodes.,world:anyone:rwcda
hadoop.zk.auth,"  Specify the auths to be used for the ACL's specified in hadoop.zk.acl.  This takes a comma-separated list of authentication mechanisms, each of the  form 'scheme:auth' (the same syntax used for the 'addAuth' command in  the ZK CLI). ",
